{
  "$schema": "https://json-schema.org/draft/2020-12/schema",
  "$id": "https://yanlab.example/schemas/missus-tom/project-manifest.json",
  "title": "Missus Tom project manifest",
  "type": "object",
  "additionalProperties": false,
  "required": [
    "schema_version",
    "project_name",
    "project_identifier",
    "created_at",
    "input_directory",
    "output_directory",
    "pipeline_identifier",
    "pipeline_version",
    "organism",
    "reference_genome",
    "annotation_source",
    "reference_resources",
    "library_type",
    "read_layout",
    "strandedness",
    "samples",
    "comparisons",
    "parameters",
    "resource_profile",
    "execution_profile",
    "application_version",
    "pipeline_status"
  ],
  "properties": {
    "schema_version": { "enum": ["1.0.0", "1.1.0"] },
    "reference_mode": { "enum": ["build", "existing-index"] },
    "project_name": { "type": "string", "minLength": 1, "maxLength": 120 },
    "project_identifier": { "type": "string", "format": "uuid" },
    "created_at": { "type": "string", "format": "date-time" },
    "input_directory": { "type": "string", "pattern": "^/" },
    "output_directory": { "type": "string", "pattern": "^/" },
    "pipeline_identifier": { "enum": ["bulk-rnaseq", "ont-analysis"] },
    "pipeline_version": { "type": "string", "minLength": 1 },
    "organism": { "type": "string", "minLength": 1 },
    "reference_genome": { "type": "string", "minLength": 1 },
    "annotation_source": { "type": "string", "minLength": 1 },
    "reference_resources": {
      "type": "object",
      "additionalProperties": { "type": "string", "pattern": "^/" }
    },
    "reference_provenance": {
      "type": ["object", "null"],
      "additionalProperties": true
    },
    "library_type": { "type": "string", "minLength": 1 },
    "read_layout": { "enum": ["paired-end", "single-end"] },
    "strandedness": { "enum": ["unstranded", "forward", "reverse", "unknown"] },
    "samples": {
      "type": "array",
      "minItems": 1,
      "items": { "$ref": "#/$defs/sample" }
    },
    "comparisons": {
      "type": "array",
      "items": { "$ref": "#/$defs/comparison" }
    },
    "figure_configuration": { "$ref": "#/$defs/figureConfiguration" },
    "parameters": { "$ref": "#/$defs/scalarMap" },
    "resource_profile": {
      "type": "object",
      "additionalProperties": false,
      "required": ["cpus", "memory_gb", "max_parallel_tasks"],
      "properties": {
        "cpus": { "type": "integer", "minimum": 1, "description": "Total workflow CPU budget" },
        "memory_gb": { "type": "number", "exclusiveMinimum": 0, "description": "Total workflow memory budget in GiB" },
        "max_parallel_tasks": { "type": "integer", "minimum": 1, "description": "Maximum concurrent tasks across the whole workflow" }
      }
    },
    "execution_profile": { "enum": ["local", "docker", "apptainer"] },
    "application_version": { "type": "string", "minLength": 1 },
    "pipeline_status": {
      "enum": ["draft", "validated", "planned", "queued", "preparing", "running", "completed", "failed", "cancelled"]
    }
  },
  "allOf": [
    {
      "if": {
        "properties": {
          "pipeline_identifier": { "const": "bulk-rnaseq" },
          "schema_version": { "const": "1.1.0" }
        },
        "required": ["pipeline_identifier", "schema_version"]
      },
      "then": { "required": ["reference_mode"] }
    },
    {
      "if": {
        "properties": {
          "pipeline_identifier": { "const": "bulk-rnaseq" },
          "schema_version": { "const": "1.1.0" },
          "parameters": {
            "properties": { "start_stage": { "const": "analysis" } },
            "required": ["start_stage"]
          }
        },
        "required": ["pipeline_identifier", "schema_version", "parameters"]
      },
      "then": {
        "properties": {
          "reference_resources": {
            "anyOf": [
              { "required": ["annotation_gtf"] },
              { "required": ["transcript_to_gene"] }
            ]
          }
        }
      },
      "else": {
        "if": {
          "properties": {
            "pipeline_identifier": { "const": "bulk-rnaseq" },
            "schema_version": { "const": "1.1.0" },
            "reference_mode": { "const": "build" }
          },
          "required": ["pipeline_identifier", "schema_version", "reference_mode"]
        },
        "then": {
          "properties": {
            "reference_resources": {
              "required": ["transcriptome_fasta", "annotation_gtf"],
              "not": { "required": ["kallisto_index"] }
            }
          }
        },
        "else": {
          "if": {
            "properties": {
              "pipeline_identifier": { "const": "bulk-rnaseq" },
              "schema_version": { "const": "1.1.0" },
              "reference_mode": { "const": "existing-index" }
            },
            "required": ["pipeline_identifier", "schema_version", "reference_mode"]
          },
          "then": {
            "properties": {
              "reference_resources": {
                "required": ["kallisto_index"],
                "anyOf": [
                  { "required": ["annotation_gtf"] },
                  { "required": ["transcript_to_gene"] }
                ]
              }
            }
          }
        }
      }
    }
  ],
  "$defs": {
    "scalar": { "type": ["string", "number", "integer", "boolean", "null"] },
    "scalarMap": {
      "type": "object",
      "additionalProperties": { "$ref": "#/$defs/scalar" }
    },
    "sample": {
      "type": "object",
      "additionalProperties": false,
        "required": ["sample_id", "r1_files", "r2_files", "condition", "biological_replicate", "batch", "covariates", "included"],
      "properties": {
        "sample_id": { "type": "string", "pattern": "^[A-Za-z0-9][A-Za-z0-9._-]*$" },
        "r1_files": { "type": "array", "items": { "type": "string", "pattern": "^/" } },
        "r2_files": { "type": "array", "items": { "type": "string", "pattern": "^/" } },
        "ont_bam_files": { "type": "array", "items": { "type": "string", "pattern": "^/" } },
        "abundance_tsv": { "type": ["string", "null"], "pattern": "^/" },
        "condition": { "type": "string" },
        "biological_replicate": { "type": "string" },
        "batch": { "type": ["string", "null"] },
        "covariates": { "$ref": "#/$defs/scalarMap" },
        "included": { "type": "boolean" }
      }
    },
    "comparison": {
      "type": "object",
      "additionalProperties": false,
      "required": ["comparison_id", "numerator", "denominator"],
      "properties": {
        "comparison_id": { "type": "string", "pattern": "^[A-Za-z0-9][A-Za-z0-9._-]*$" },
        "numerator": { "type": "string", "minLength": 1, "pattern": "^[^\\t\\r\\n]+$" },
        "denominator": { "type": "string", "minLength": 1, "pattern": "^[^\\t\\r\\n]+$" },
        "label": { "type": ["string", "null"] },
        "intervention": { "type": ["string", "null"], "pattern": "^[^\\t\\r\\n]+$" }
      }
    }
    ,"axisRange": {
      "type": "object", "additionalProperties": false,
      "required": ["mode"],
      "properties": {"mode": {"enum": ["automatic", "manual"]}, "minimum": {"type": "number"}, "maximum": {"type": "number"}}
    },
    "customFigure": {
      "type": "object", "additionalProperties": false,
      "required": ["figure_id", "figure_type", "title"],
      "properties": {
        "figure_id": {"type": "string", "pattern": "^[A-Za-z0-9][A-Za-z0-9._-]*$"},
        "figure_type": {"enum": ["gene_metric_scatter", "sample_correlation_heatmap", "expression_distribution_boxplot", "top_de_genes_bar", "estimated_gene_count_bar"]},
        "title": {"type": "string", "minLength": 1, "maxLength": 160},
        "x_variable": {"type": ["string", "null"]}, "y_variable": {"type": ["string", "null"]},
        "x_axis": {"$ref": "#/$defs/axisRange"}, "y_axis": {"$ref": "#/$defs/axisRange"},
        "x_label": {"type": ["string", "null"]}, "y_label": {"type": ["string", "null"]},
        "top_n": {"type": ["integer", "null"], "minimum": 1, "maximum": 50}
      }
    },
    "figureConfiguration": {
      "type": "object", "additionalProperties": false,
      "required": ["version", "custom_figures"],
      "properties": {"version": {"const": 1}, "custom_figures": {"type": "array", "maxItems": 20, "items": {"$ref": "#/$defs/customFigure"}}}
    }
  }
}
